id,document,metadata
decd6f1c-c932-4e41-91ba-f2188e23fcba,Artificial intelligence is transforming how businesses operate across industries.,"{""source"": ""research_paper"", ""author"": ""Dr. Alex Johnson"", ""year"": 2023, ""keywords_str"": ""AI, business, transformation""}"
e41cbd2a-ae61-4cda-bd76-ee24fa72bd7b,Climate change poses significant risks to global food security and agricultural systems.,"{""source"": ""journal_article"", ""author"": ""Maria Rodriguez"", ""year"": 2022, ""keywords_str"": ""climate change, food security, agriculture""}"
7ab201d7-e0a6-413d-b9e2-d9677d566ccb,Quantum computing may revolutionize cryptography and threaten current encryption standards.,"{""source"": ""conference_paper"", ""author"": ""Dr. Sam Chen"", ""year"": 2023, ""keywords_str"": ""quantum computing, cryptography, encryption""}"
d2b1cf33-ea85-4fea-9f93-5f01cd48a566,Renewable energy investments reached a record high in the past fiscal year.,"{""source"": ""financial_report"", ""author"": ""Green Energy Institute"", ""year"": 2024, ""keywords_str"": ""renewable energy, investments, finance""}"
b238d37d-e8a8-4849-833c-e56fc376cc2d,Machine learning models can detect early signs of medical conditions from patient data.,"{""source"": ""medical_journal"", ""author"": ""Dr. Lisa Brown"", ""year"": 2023, ""keywords_str"": ""machine learning, healthcare, diagnostics""}"
e75d2f81-bb90-4511-bea5-f09397bf0d2c,Digital privacy concerns are increasing with the rise of facial recognition technology.,"{""source"": ""tech_blog"", ""author"": ""Privacy Watch"", ""year"": 2023, ""keywords_str"": ""privacy, facial recognition, technology""}"
7f25c5da-f95e-46ed-866a-c0f2fbc1cda7,Space exploration missions plan to establish a permanent lunar base within the decade.,"{""source"": ""space_agency_report"", ""author"": ""International Space Consortium"", ""year"": 2024, ""keywords_str"": ""space exploration, lunar base, astronomy""}"
f555b16f-7702-40f2-b0ef-a52416828843,Blockchain technology is being applied to supply chain management to improve transparency.,"{""source"": ""industry_whitepaper"", ""author"": ""Tech Solutions Inc."", ""year"": 2023, ""keywords_str"": ""blockchain, supply chain, transparency""}"
1cb16ae6-4099-457e-9b31-b9b687122b88,Urban planning strategies are adapting to accommodate autonomous vehicles.,"{""source"": ""urban_studies_journal"", ""author"": ""City Planning Institute"", ""year"": 2023, ""keywords_str"": ""urban planning, autonomous vehicles, infrastructure""}"
273baa48-32e9-458c-89c5-d199f40d0c24,Genetic editing techniques show promise for treating previously incurable diseases.,"{""source"": ""biotech_research"", ""author"": ""Dr. Emma Watson"", ""year"": 2024, ""keywords_str"": ""genetic editing, CRISPR, medical research""}"
