id,document,metadata
fae17464-3cb6-4893-ac4b-b2e390b4a1e7,Artificial intelligence is transforming how businesses operate across industries.,"{""source"": ""research_paper"", ""author"": ""Dr. Alex Johnson"", ""year"": 2023, ""keywords_str"": ""AI, business, transformation""}"
50080720-d7b0-44b2-821b-16364e73a314,Climate change poses significant risks to global food security and agricultural systems.,"{""source"": ""journal_article"", ""author"": ""Maria Rodriguez"", ""year"": 2022, ""keywords_str"": ""climate change, food security, agriculture""}"
bad24a98-a1c8-46be-9b43-6193e841e6f4,Quantum computing may revolutionize cryptography and threaten current encryption standards.,"{""source"": ""conference_paper"", ""author"": ""Dr. Sam Chen"", ""year"": 2023, ""keywords_str"": ""quantum computing, cryptography, encryption""}"
f7f59afd-3129-450d-abff-eaf1c038f58c,Renewable energy investments reached a record high in the past fiscal year.,"{""source"": ""financial_report"", ""author"": ""Green Energy Institute"", ""year"": 2024, ""keywords_str"": ""renewable energy, investments, finance""}"
48b192d9-5840-4b8f-a497-34621b3c28ac,Machine learning models can detect early signs of medical conditions from patient data.,"{""source"": ""medical_journal"", ""author"": ""Dr. Lisa Brown"", ""year"": 2023, ""keywords_str"": ""machine learning, healthcare, diagnostics""}"
3436b5a3-3803-4e2a-8e7a-b61263641e5b,Digital privacy concerns are increasing with the rise of facial recognition technology.,"{""source"": ""tech_blog"", ""author"": ""Privacy Watch"", ""year"": 2023, ""keywords_str"": ""privacy, facial recognition, technology""}"
5c46fce1-a53f-4f91-a45d-8c2b695ec035,Space exploration missions plan to establish a permanent lunar base within the decade.,"{""source"": ""space_agency_report"", ""author"": ""International Space Consortium"", ""year"": 2024, ""keywords_str"": ""space exploration, lunar base, astronomy""}"
0a5de725-7699-43fb-a65a-277d35533384,Blockchain technology is being applied to supply chain management to improve transparency.,"{""source"": ""industry_whitepaper"", ""author"": ""Tech Solutions Inc."", ""year"": 2023, ""keywords_str"": ""blockchain, supply chain, transparency""}"
a618737f-7a42-4087-b90f-1dd5177f087b,Urban planning strategies are adapting to accommodate autonomous vehicles.,"{""source"": ""urban_studies_journal"", ""author"": ""City Planning Institute"", ""year"": 2023, ""keywords_str"": ""urban planning, autonomous vehicles, infrastructure""}"
1dc59a60-b569-4d38-8440-0c2db0d495bc,Genetic editing techniques show promise for treating previously incurable diseases.,"{""source"": ""biotech_research"", ""author"": ""Dr. Emma Watson"", ""year"": 2024, ""keywords_str"": ""genetic editing, CRISPR, medical research""}"
